{
  "phase": "05-B",
  "title": "Authenticated Runtime Acceptance & Real Agent Repair",
  "status": "BLOCKED",
  "repository": "https://github.com/SAeedajf/ui-ux-skill",
  "base_commit": "5a18b097ade439281e9d39b5c6476e84eb2e6ab0",
  "output_commit": "5a18b097ade439281e9d39b5c6476e84eb2e6ab0",
  "branch": "codex/ui-ux-plugin-phase-05b",
  "pull_request": "https://github.com/SAeedajf/ui-ux-skill/pull/16",
  "codex_cli": {
    "path": "/home/<user>/.nvm/versions/node/v22.23.1/bin/codex",
    "version": "0.153.4",
    "config_model": "gpt-6-luna",
    "account_usage_allowed": true
  },
  "model_id": "gpt-6-luna",
  "auth_method": "ChatGPT",
  "auth_status": "Authenticated; codex login status succeeded and ordinaryUsageAllowed=true. Model request returned HTTP 400 before agent execution.",
  "plugin_install_method": "Temporary local marketplace and plugin install in the authenticated user profile; removed after the model request was rejected. Installed plugin and marketplace inventories match the saved pre-install state.",
  "plugin_source": {
    "plugin_id": "ui-ux-pro@ui-ux-pro-marketplace",
    "version": "0.1.0",
    "source": "local Phase 05-B worktree, base commit 5a18b097ade439281e9d39b5c6476e84eb2e6ab0",
    "manifest_sha256": "1456bc5bf0f206ca92554b44b2377048259c209848ed64ef6c31e5b40290ca54",
    "archive_sha256": "611b8eddaf74821dd2a1dd6a1d8ae576c32e20b4b23db12ec7021aa6ae634c7c"
  },
  "plugin_discovery": {
    "status": "PASS",
    "plugin_skill_count": 15,
    "plugin_namespace_count": 15,
    "legacy_overlap_count": 8,
    "rollback_verified": true
  },
  "positive_smoke": {
    "status": "BLOCKED",
    "attempted": true,
    "accepted": false,
    "trace_evidence": "docs/plugin/reports/evidence/phase-05b-positive-blocked.jsonl",
    "reason": "Codex returned HTTP 400 before model execution: gpt-6-luna is not supported when using Codex with a ChatGPT account. No Agent response or Skill activation occurred."
  },
  "negative_smoke": {
    "status": "NOT_RUN",
    "attempted": false,
    "accepted": false,
    "trace_evidence": null,
    "reason": "Stopped after the non-transient unsupported-model error; the owner must select or authorize a model supported by this ChatGPT CLI account."
  },
  "skills_actually_loaded": [],
  "fixture_baseline": {
    "status": "EXPECTED_FAILURES",
    "tests_run": 5,
    "expected_failures": 5,
    "evidence": "docs/plugin/reports/evidence/phase-05b-fixture-baseline.txt"
  },
  "agent_authored_diff": {
    "created": false,
    "files": [],
    "diff_evidence": null
  },
  "repair_trace_evidence": null,
  "fixture_after": {
    "status": "NOT_RUN",
    "tests_run": 0,
    "passed": 0
  },
  "regression_results": "NOT_RUN; no Agent-authored change exists.",
  "browser_results": "NOT_RUN; there is no post-repair state to verify. Firefox is present, but Playwright/Selenium packages are unavailable.",
  "duplicate_skill_findings": "The prompt-input inventory exposed 15 namespaced Plugin skills and the current profile has 8 same-name legacy UI/UX directories. The model request failed before any Skill selection, so precedence, source choice, and double-loading effects remain unverified. No Legacy Skills were changed.",
  "chatgpt_plugin_status": "Existing plugin plugins_6acfa25d79388191b9861545d52f6d03 remains PRIVATE, version 0.1.0; this phase did not modify it.",
  "chatgpt_runtime_status": "NOT_RUN",
  "source_rights_status": "UNCHANGED_UNRESOLVED; prior six partial source records and S20 direct-access limit remain. Phase 05-B added no Plugin content.",
  "model_call_count": {
    "attempted": 1,
    "accepted": 0,
    "positive": 1,
    "negative": 0,
    "repair": 0,
    "retry": 0
  },
  "ci_status": "PENDING",
  "ci_run_url": null,
  "ci_output_commit": null,
  "ci_checked_at": null,
  "test_count": 57,
  "evidence_paths": [
    "docs/plugin/reports/phase-05b-evidence.md",
    "docs/plugin/reports/evidence/phase-05b-positive-blocked.jsonl",
    "docs/plugin/reports/evidence/phase-05b-fixture-baseline.txt"
  ],
  "blockers": [
    "Codex CLI 0.153.4 is authenticated and usage is available, but its HTTP 400 response says gpt-6-luna is not supported when using Codex with a ChatGPT account.",
    "No Skill was activated and no Agent repair was executed; positive/negative activation and post-repair/browser gates remain open."
  ],
  "owner_action_required": [
    "Choose or authorize a model ID supported by this ChatGPT account in Codex CLI. Keep the persistent default unchanged unless the owner explicitly requests otherwise; a one-run override can be considered only after approval.",
    "After the model choice is confirmed, authorize up to three calls: positive smoke, negative smoke, and one fixture repair. Do not use another account or model to bypass usage limits.",
    "If the owner wants the isolated Plugin-only profile, complete its official interactive login directly; do not copy authentication files."
  ],
  "next_phase_recommendation": "Continue Phase 05-B after the owner resolves CLI model compatibility. Do not begin Phase 06, change legacy Skills, modify the private ChatGPT plugin, or publish publicly."
}
